{
  "schema_version": 1,
  "package_id": "uos.device.orion.input",
  "version": "0.1.0",
  "kind": "device-support",
  "provides": {"component": "input-service"},
  "compatibility": {"architectures": ["arm64"], "profile_ids": ["uos.profile.synthetic.orion-arm64-v1"], "kernel_abi": "uos-kabi-orion-1", "bootstrap_version_range": ">=0.1.0 <0.2.0", "required_capabilities": {"input": "working"}},
  "payload": {"sha256": "4444444444444444444444444444444444444444444444444444444444444444", "bytes": 64, "install_mode": "inactive-slot"},
  "security": {"signer": "fixture-root", "signature": "fixture:fixture-root:trusted", "expires": "2030-01-01T00:00:00Z"}
}
